{
  "schema": "https://compliance-atoms.com/schemas/atom-v1.json",
  "type": "control",
  "id": "iso27001-a8-24-use-of-cryptography",
  "version": "1.0.0",
  "name": "ISO27001 A.8.24 Use of Cryptography",
  "description": "Rules for the effective use of cryptography, including cryptographic key management, shall be defined and implemented to protect information based on its classification and applicable legal, statutory, regulatory, and contractual requirements.",
  "framework": "iso27001",
  "control_id": "A.8.24",
  "requirement_text": "Rules for the effective use of cryptography, including cryptographic key management, shall be defined and implemented.",
  "evidence_types": ["audit-log"],
  "tags": ["iso27001", "cryptography", "key-management", "encryption", "technological", "a8-24"]
}
